{
  "properties": {
    "customer_support": {
      "$ref": "customer-support.json"
    },
    "checkout_date": {
      "type": "string",
      "example": "2019-01-02",
      "description": "The user's check-out date in YYYY-MM-DD.",
      "format": "date"
    },
    "checkin_date": {
      "type": "string",
      "example": "2019-01-01",
      "description": "The user's check-in date in YYYY-MM-DD.",
      "format": "date"
    },
    "status": {
      "example": "AVAILABLE",
      "enum": [
        "ADJUSTED",
        "AVAILABLE",
        "SOLD_OUT"
      ]
    },
    "partner_reference": {
      "type": "string",
      "example": "1",
      "description": "Advertiser's unique hotel id."
    },
    "room_type": {
      "$ref": "room-type.json"
    }
  },
  "required": [
    "status",
    "checkin_date",
    "checkout_date",
    "partner_reference",
    "room_type",
    "customer_support"
  ],
  "description": "Schema of a booking preparation.",
  "title": "Booking Prepare Available",
  "type": "object",
  "$schema": "http://json-schema.org/schema#"
}